{
  "id": "hrm:goal/established-scar-repair",
  "type": "goal",
  "name": "Repair of an established scar",
  "parent": "hrm:goal/universal-repair",
  "description": "Convert a mature fibrotic dermal scar — one that already exists — back into dermis with native matrix organisation, appendages and function. Distinct from preventing scar in a fresh injury: prevention helps the next wound, reversal helps everyone already scarred, and every fibrotic organ shares the problem.",
  "projections": [
    "universal-repair",
    "rejuvenation"
  ],
  "existenceProof": "None located for dermis. Spiny mice regenerate rather than scar, but no reversal of an already-formed mammalian scar is cited on this map.",
  "requires": [
    {
      "all": [
        "hrm:capability/established-dermal-scar-reversal",
        "hrm:capability/native-ecm-organisation-reconstruction",
        "hrm:capability/organised-microvascular-network-in-regenerated-dermis",
        "hrm:capability/cutaneous-sensory-reinnervation"
      ]
    },
    {
      "any": [
        "hrm:capability/hair-follicle-neogenesis-after-wounding",
        "hrm:capability/appendage-bearing-skin-from-pluripotent-cells"
      ],
      "note": "Appendages must come from somewhere: neogenesis in the remodelled tissue or a graft."
    }
  ],
  "blockedBy": [
    "hrm:question/established-scar-remodelling-to-native-architecture"
  ],
  "informationLimited": false,
  "provenance": {
    "proposedBy": {
      "type": "ai",
      "name": "Claude Code session e7dc5601 (Anthropic)",
      "model": "claude-opus-5",
      "session": "e7dc5601-1690-47c6-bf13-9ca150d31960"
    },
    "method": "manual reasoning from the cited sources' abstracts (PubMed) and Crossref metadata, checked 2026-09-11; no source opened at figure level",
    "date": "2026-09-11"
  },
  "review": {
    "state": "ai-proposed",
    "date": "2026-09-11"
  }
}
