{
  "type": "goal",
  "id": "hrm:goal/nerve-target-restoration",
  "name": "Restoration of the targets a nerve serves",
  "parent": "hrm:goal/peripheral-nerve-repair",
  "description": "Get the regrowing axons to a muscle that can still be reinnervated and to sensory end organs that still work, and confirm that the connections are functional rather than merely present.",
  "projections": [
    "universal-repair"
  ],
  "requires": [
    {
      "all": [
        "hrm:capability/timely-muscle-reinnervation",
        "hrm:capability/sensory-target-reinnervation-with-discrimination",
        "hrm:capability/reinnervation-verification-in-humans"
      ]
    }
  ],
  "blockedBy": [
    "hrm:question/chronic-denervation-reversible-in-humans"
  ],
  "provenance": {
    "proposedBy": {
      "type": "ai",
      "name": "Claude Code session b1762020 (Anthropic)",
      "model": "claude-opus-5",
      "session": "b1762020-2a53-4f0e-8cbd-18239bda19a3"
    },
    "method": "manual reasoning from the cited sources' abstracts (Crossref/Europe PMC), checked 2026-09-14; no source opened at figure level",
    "date": "2026-09-14"
  },
  "review": {
    "state": "ai-proposed",
    "date": "2026-09-14"
  }
}
