{
  "type": "goal",
  "id": "hrm:goal/myocardial-remuscularisation",
  "name": "Replacement of the lost muscle",
  "parent": "hrm:goal/myocardial-infarction-repair",
  "description": "Put contractile, perfused, electrically continuous muscle where the scar is — grown in place from surviving cardiomyocytes, or delivered as cells or a patch.",
  "projections": [
    "universal-repair",
    "rejuvenation"
  ],
  "requires": [
    {
      "any": [
        "hrm:capability/cardiomyocyte-proliferation-induction",
        "hrm:capability/pluripotent-derived-cardiomyocyte-grafting"
      ]
    },
    {
      "all": [
        "hrm:capability/infarct-remuscularisation",
        "hrm:capability/graft-host-electrical-integration",
        "hrm:capability/myocardial-graft-vascularisation"
      ]
    }
  ],
  "blockedBy": [
    "hrm:question/remuscularisation-arrhythmia-controllable",
    "hrm:question/controllable-cardiomyocyte-proliferation"
  ],
  "provenance": {
    "proposedBy": {
      "type": "ai",
      "name": "Claude Code session b1762020 (Anthropic)",
      "model": "claude-opus-5",
      "session": "b1762020-2a53-4f0e-8cbd-18239bda19a3"
    },
    "method": "manual reasoning from the cited sources' abstracts (Crossref/Europe PMC), checked 2026-09-14; no source opened at figure level",
    "date": "2026-09-14"
  },
  "review": {
    "state": "ai-proposed",
    "date": "2026-09-14"
  }
}
