{
  "type": "goal",
  "id": "hrm:goal/spinal-cord-injury-repair",
  "name": "Repair of a spinal cord injury",
  "parent": "hrm:goal/universal-repair",
  "description": "After the spinal cord is crushed or severed, restore what the person lost: voluntary movement below the lesion, sensation, and autonomic control of bladder, bowel, blood pressure and sexual function. Restoring the tract and restoring the function are different projects; the map keeps them apart because their evidence is decades apart.",
  "projections": [
    "universal-repair"
  ],
  "existenceProof": "None for tract regeneration in a human. Function has been restored partially without repair: people with motor-complete injury have stepped over ground with epidural stimulation, and a brain-spine interface has restored volitional walking in one participant. Fish and amphibians regenerate the cord; mammals do not.",
  "requires": [
    {
      "all": [
        "hrm:capability/acute-cord-damage-limitation",
        "hrm:capability/autonomic-function-restoration-after-sci"
      ]
    },
    {
      "any": [
        "hrm:capability/corticospinal-axon-regrowth-across-a-lesion",
        "hrm:capability/spinal-circuit-reactivation-by-stimulation",
        "hrm:capability/brain-spine-interface-volitional-control"
      ],
      "note": "OR-group: regrow the tract, drive the circuitry below it, or bridge the gap electronically. These are three different bets on the same deficit and the map does not assume one wins."
    }
  ],
  "blockedBy": [
    "hrm:question/regrown-axons-form-useful-circuits",
    "hrm:question/stimulation-benefit-without-spared-fibres",
    "hrm:question/cord-repair-restores-autonomic-function"
  ],
  "testSuite": [
    {
      "scenario": "incomplete injury, early surgical decompression",
      "state": "partial",
      "note": "earlier decompression is associated with better neurological improvement"
    },
    {
      "scenario": "motor-complete injury, voluntary stepping with stimulation",
      "state": "partial",
      "note": "shown in small numbers of participants, in specialist centres, with training"
    },
    {
      "scenario": "volitional natural walking through a brain-spine interface",
      "state": "partial",
      "note": "one participant, one group"
    },
    {
      "scenario": "regrowth of a severed corticospinal tract to its original targets",
      "state": "unsolved",
      "note": "rodent-stage"
    },
    {
      "scenario": "restored bladder and bowel control after complete injury",
      "state": "unsolved",
      "note": "the deficit patients rank highest is the least addressed"
    }
  ],
  "informationLimited": false,
  "provenance": {
    "proposedBy": {
      "type": "ai",
      "name": "Claude Code session b1762020 (Anthropic)",
      "model": "claude-opus-5",
      "session": "b1762020-2a53-4f0e-8cbd-18239bda19a3"
    },
    "method": "manual reasoning from the cited sources' abstracts (Crossref/Europe PMC), checked 2026-09-14; no source opened at figure level",
    "date": "2026-09-14"
  },
  "review": {
    "state": "ai-proposed",
    "date": "2026-09-14"
  }
}
