{
  "type": "goal",
  "id": "hrm:goal/aging-rate-modification",
  "name": "Slowing the rate of aging pharmacologically",
  "parent": "hrm:goal/rejuvenation",
  "description": "Slow the accumulation of age-related dysfunction with a drug taken over years — distinct from reversing damage already accumulated, which is what the rest of this projection is about.",
  "projections": [
    "rejuvenation"
  ],
  "requires": [
    {
      "all": [
        "hrm:capability/pharmacological-aging-rate-reduction",
        "hrm:capability/biological-age-measurement-that-predicts-outcome"
      ]
    }
  ],
  "blockedBy": [
    "hrm:question/geroprotector-benefit-in-humans",
    "hrm:question/clocks-track-intervention-benefit"
  ],
  "provenance": {
    "proposedBy": {
      "type": "ai",
      "name": "Claude Code session b1762020 (Anthropic)",
      "model": "claude-opus-5",
      "session": "b1762020-2a53-4f0e-8cbd-18239bda19a3"
    },
    "method": "manual reasoning from the cited sources' abstracts (Crossref/Europe PMC), checked 2026-09-14; no source opened at figure level",
    "date": "2026-09-14"
  },
  "review": {
    "state": "ai-proposed",
    "date": "2026-09-14"
  }
}
