{
  "type": "goal",
  "id": "hrm:goal/skin-immediate-stabilisation",
  "name": "Immediate stabilisation of a skin injury",
  "parent": "hrm:goal/scarless-skin-repair",
  "description": "In the first minutes: stop bleeding and restore a barrier so that nothing irrecoverable is lost while repair is organised.",
  "projections": [
    "universal-repair"
  ],
  "requires": [
    {
      "all": [
        "hrm:capability/skin-haemostasis",
        "hrm:capability/temporary-barrier-restoration"
      ]
    }
  ],
  "provenance": {
    "proposedBy": {
      "type": "ai",
      "name": "Claude Code session e7dc5601 (Anthropic)",
      "model": "claude-opus-5",
      "session": "e7dc5601-1690-47c6-bf13-9ca150d31960"
    },
    "method": "manual reasoning from the cited sources' abstracts (PubMed) and Crossref metadata, checked 2026-09-11; no source opened at figure level",
    "date": "2026-09-11"
  },
  "review": {
    "state": "ai-proposed",
    "date": "2026-09-11"
  }
}
