{
  "type": "goal",
  "id": "hrm:goal/senescent-cell-clearance-goal",
  "name": "Removal of the cells that make tissue old",
  "parent": "hrm:goal/systemic-rejuvenation",
  "description": "Clear senescent cells — cells that have stopped dividing and secrete an inflammatory programme into the tissue around them — from an aged or damaged organ, and show that the tissue works better afterwards.",
  "projections": [
    "rejuvenation"
  ],
  "existenceProof": "Genetic clearance of p16-positive cells extends healthspan in mice, and senolytic drugs improve physical function and lifespan in old mice. In humans, two small open-label studies report reduced senescent cell burden and, in one, improved walking distance; neither had a control arm.",
  "requires": [
    {
      "all": [
        "hrm:capability/senescent-cell-clearance-in-humans",
        "hrm:capability/senescent-cell-burden-measurement"
      ]
    }
  ],
  "blockedBy": [
    "hrm:question/senolytics-improve-human-function"
  ],
  "provenance": {
    "proposedBy": {
      "type": "ai",
      "name": "Claude Code session b1762020 (Anthropic)",
      "model": "claude-opus-5",
      "session": "b1762020-2a53-4f0e-8cbd-18239bda19a3"
    },
    "method": "manual reasoning from the cited sources' abstracts (Crossref/Europe PMC), checked 2026-09-14; no source opened at figure level",
    "date": "2026-09-14"
  },
  "review": {
    "state": "ai-proposed",
    "date": "2026-09-14"
  }
}
