{
  "type": "goal",
  "id": "hrm:goal/sci-damage-limitation",
  "name": "Limiting the damage in the first hours",
  "parent": "hrm:goal/spinal-cord-injury-repair",
  "description": "Prevent the secondary injury that follows the mechanical one — ischaemia, oedema, inflammation, excitotoxicity — so that less cord has to be repaired later.",
  "projections": [
    "universal-repair"
  ],
  "requires": [
    {
      "all": [
        "hrm:capability/acute-cord-damage-limitation"
      ]
    }
  ],
  "provenance": {
    "proposedBy": {
      "type": "ai",
      "name": "Claude Code session b1762020 (Anthropic)",
      "model": "claude-opus-5",
      "session": "b1762020-2a53-4f0e-8cbd-18239bda19a3"
    },
    "method": "manual reasoning from the cited sources' abstracts (Crossref/Europe PMC), checked 2026-09-14; no source opened at figure level",
    "date": "2026-09-14"
  },
  "review": {
    "state": "ai-proposed",
    "date": "2026-09-14"
  }
}
