{
  "type": "goal",
  "id": "hrm:goal/myocardial-salvage",
  "name": "Salvage of the muscle at risk",
  "parent": "hrm:goal/myocardial-infarction-repair",
  "description": "Reopen the occluded artery fast enough that muscle which has not yet died survives, and limit reperfusion injury.",
  "projections": [
    "universal-repair"
  ],
  "requires": [
    {
      "all": [
        "hrm:capability/acute-reperfusion-of-the-infarct-artery"
      ]
    }
  ],
  "provenance": {
    "proposedBy": {
      "type": "ai",
      "name": "Claude Code session b1762020 (Anthropic)",
      "model": "claude-opus-5",
      "session": "b1762020-2a53-4f0e-8cbd-18239bda19a3"
    },
    "method": "manual reasoning from the cited sources' abstracts (Crossref/Europe PMC), checked 2026-09-14; no source opened at figure level",
    "date": "2026-09-14"
  },
  "review": {
    "state": "ai-proposed",
    "date": "2026-09-14"
  }
}
