{
  "type": "goal",
  "id": "hrm:goal/nerve-continuity-restoration",
  "name": "Restoration of nerve continuity",
  "parent": "hrm:goal/peripheral-nerve-repair",
  "description": "Re-establish a physical path from the proximal stump to the distal nerve, with fascicles aligned and without tension, whether by direct repair, a graft or a conduit.",
  "projections": [
    "universal-repair"
  ],
  "requires": [
    {
      "any": [
        "hrm:capability/nerve-gap-bridging",
        "hrm:capability/nerve-transfer-from-a-donor-nerve"
      ]
    },
    {
      "all": [
        "hrm:capability/axon-regrowth-across-a-repair"
      ]
    }
  ],
  "provenance": {
    "proposedBy": {
      "type": "ai",
      "name": "Claude Code session b1762020 (Anthropic)",
      "model": "claude-opus-5",
      "session": "b1762020-2a53-4f0e-8cbd-18239bda19a3"
    },
    "method": "manual reasoning from the cited sources' abstracts (Crossref/Europe PMC), checked 2026-09-14; no source opened at figure level",
    "date": "2026-09-14"
  },
  "review": {
    "state": "ai-proposed",
    "date": "2026-09-14"
  }
}
